{
  "receipt_version": "1.0",
  "receipt_id": "devnet:5yWAEdtjihJjGWk9phXLvAG831r9yqvT7qrPgbmaFXoS5whsFSLLuuLLFGnUmKpAE22RWvFxPk3NDn1oCqfEqEf8",
  "created_at": "2026-05-09T03:17:24.878Z",
  "network": "devnet",
  "program_id": "APn6AN7FphYAjUEJWhvGZa1T5nfQDNmCcFW2244p4UoD",
  "signature": "5yWAEdtjihJjGWk9phXLvAG831r9yqvT7qrPgbmaFXoS5whsFSLLuuLLFGnUmKpAE22RWvFxPk3NDn1oCqfEqEf8",
  "explorer_url": "https://explorer.solana.com/tx/5yWAEdtjihJjGWk9phXLvAG831r9yqvT7qrPgbmaFXoS5whsFSLLuuLLFGnUmKpAE22RWvFxPk3NDn1oCqfEqEf8?cluster=devnet",
  "policy": "vCeG5UbD8BwpgDCtEetj5dp2haR1Vd6cDPFBhCvQ8yp",
  "policy_id": "1778296629815",
  "agent": "GDVVFih63F37uqnRFeBgWtQPAgfrGD2Hi1V6eu7MhcTi",
  "owner": "AePFKUi41JqyazumSmFTVxp64tev58RuQycdWfnJwMmz",
  "vault": "GY9NCwVb5e4wRhikpLmSQELMr5ynjdFdDD2vdYvMwBMb",
  "mint": "4eC4i6pmM9G6R2qSGCaNcot6KTv6xx1FcAn5GE7Px7qK",
  "source": "GY9NCwVb5e4wRhikpLmSQELMr5ynjdFdDD2vdYvMwBMb",
  "destination": "ETdQsQEH4MsJWfku4s7QjWbpQW31SzRqWVFwDwoK9X3G",
  "destination_label": "Over-cap DemoUSD merchant attempt",
  "attempt_type": "blocked_spend",
  "status": "blocked",
  "requested_amount": "50000000",
  "actual_inner_transfer_amount": "0",
  "vault_balance_before": "45000000",
  "vault_balance_after": "45000000",
  "vault_delta": "0",
  "inner_token_transfers": 0,
  "rule_triggered": "perTxCap",
  "guard_error": "Program log: AnchorError thrown in programs/vajra/src/instructions/execute_guarded_transfer.rs:80. Error Code: PerTxCapExceeded. Error Number: 6007. Error Message: Amount exceeds per-transaction cap.",
  "logs": [
    "Program log: VAJRA_GUARD:1:revoked_check",
    "Program log: VAJRA_GUARD:2:expiry_check",
    "Program log: VAJRA_GUARD:3:signer_check",
    "Program log: VAJRA_GUARD:4:amount_zero_check",
    "Program log: VAJRA_GUARD:5:per_tx_cap_check",
    "Program log: AnchorError thrown in programs/vajra/src/instructions/execute_guarded_transfer.rs:80. Error Code: PerTxCapExceeded. Error Number: 6007. Error Message: Amount exceeds per-transaction cap.",
    "Program APn6AN7FphYAjUEJWhvGZa1T5nfQDNmCcFW2244p4UoD failed: custom program error: 0x1777"
  ],
  "raw_transaction_summary": {
    "err": { "InstructionError": [0, { "Custom": 6007 }] },
    "slot": 461078111
  },
  "verifier": {
    "verified": true,
    "method": "rpc_verifier_plus_measured_vault_balance",
    "checked_at": "2026-05-09T03:17:24.878Z"
  },
  "receipt_hash": "86061c55fd156b30bb9f7dcb54f5803e4633a16ae4c025145fe03e6e80cfb8ec"
}
