{
  "receipt_version": "1.0",
  "receipt_id": "devnet:382Mj4AgfWcMcmzaMZebrbmbBBGTDezghXWssJnFBy6y33ZkpT48uFHs7toerSFmPmGuAVtefM1CWvG2miDYXvAo",
  "created_at": "2026-05-09T03:17:16.787Z",
  "network": "devnet",
  "program_id": "APn6AN7FphYAjUEJWhvGZa1T5nfQDNmCcFW2244p4UoD",
  "signature": "382Mj4AgfWcMcmzaMZebrbmbBBGTDezghXWssJnFBy6y33ZkpT48uFHs7toerSFmPmGuAVtefM1CWvG2miDYXvAo",
  "explorer_url": "https://explorer.solana.com/tx/382Mj4AgfWcMcmzaMZebrbmbBBGTDezghXWssJnFBy6y33ZkpT48uFHs7toerSFmPmGuAVtefM1CWvG2miDYXvAo?cluster=devnet",
  "policy": "vCeG5UbD8BwpgDCtEetj5dp2haR1Vd6cDPFBhCvQ8yp",
  "policy_id": "1778296629815",
  "agent": "GDVVFih63F37uqnRFeBgWtQPAgfrGD2Hi1V6eu7MhcTi",
  "owner": "AePFKUi41JqyazumSmFTVxp64tev58RuQycdWfnJwMmz",
  "vault": "GY9NCwVb5e4wRhikpLmSQELMr5ynjdFdDD2vdYvMwBMb",
  "mint": "4eC4i6pmM9G6R2qSGCaNcot6KTv6xx1FcAn5GE7Px7qK",
  "source": "GY9NCwVb5e4wRhikpLmSQELMr5ynjdFdDD2vdYvMwBMb",
  "destination": "ETdQsQEH4MsJWfku4s7QjWbpQW31SzRqWVFwDwoK9X3G",
  "destination_label": "Allowed DemoUSD merchant",
  "attempt_type": "allowed_spend",
  "status": "allowed",
  "requested_amount": "5000000",
  "actual_inner_transfer_amount": "5000000",
  "vault_balance_before": "50000000",
  "vault_balance_after": "45000000",
  "vault_delta": "-5000000",
  "inner_token_transfers": 1,
  "rule_triggered": "all_clear",
  "guard_error": "",
  "logs": [
    "Program log: VAJRA_GUARD:5:per_tx_cap_check",
    "Program log: VAJRA_GUARD:6:budget_check",
    "Program log: VAJRA_GUARD:6B:period_budget_check",
    "Program log: VAJRA_GUARD:6C:velocity_check",
    "Program log: VAJRA_GUARD:7:destination_rule_check",
    "Program log: VAJRA_GUARD:8:destination_mint_check",
    "Program log: VAJRA_GUARD:9:vault_mint_check",
    "Program log: VAJRA_GUARD:10:vault_owner_check",
    "Program log: VAJRA_GUARD:11:vault_balance_check",
    "Program log: VAJRA_GUARD:12:all_clear_cpi_transfer"
  ],
  "raw_transaction_summary": { "err": null, "slot": 461078088 },
  "verifier": {
    "verified": true,
    "method": "rpc_verifier_plus_measured_vault_balance",
    "checked_at": "2026-05-09T03:17:16.787Z"
  },
  "receipt_hash": "ad7498dee090fde52fa70502f0650672844558feaa51f03de35b152f821eafc1"
}
