[
  {
    "receipt_version": "1.0",
    "receipt_id": "devnet:382Mj4AgfWcMcmzaMZebrbmbBBGTDezghXWssJnFBy6y33ZkpT48uFHs7toerSFmPmGuAVtefM1CWvG2miDYXvAo",
    "created_at": "2026-05-09T03:17:16.787Z",
    "network": "devnet",
    "program_id": "APn6AN7FphYAjUEJWhvGZa1T5nfQDNmCcFW2244p4UoD",
    "signature": "382Mj4AgfWcMcmzaMZebrbmbBBGTDezghXWssJnFBy6y33ZkpT48uFHs7toerSFmPmGuAVtefM1CWvG2miDYXvAo",
    "explorer_url": "https://explorer.solana.com/tx/382Mj4AgfWcMcmzaMZebrbmbBBGTDezghXWssJnFBy6y33ZkpT48uFHs7toerSFmPmGuAVtefM1CWvG2miDYXvAo?cluster=devnet",
    "policy": "vCeG5UbD8BwpgDCtEetj5dp2haR1Vd6cDPFBhCvQ8yp",
    "policy_id": "1778296629815",
    "agent": "GDVVFih63F37uqnRFeBgWtQPAgfrGD2Hi1V6eu7MhcTi",
    "owner": "AePFKUi41JqyazumSmFTVxp64tev58RuQycdWfnJwMmz",
    "vault": "GY9NCwVb5e4wRhikpLmSQELMr5ynjdFdDD2vdYvMwBMb",
    "mint": "4eC4i6pmM9G6R2qSGCaNcot6KTv6xx1FcAn5GE7Px7qK",
    "source": "GY9NCwVb5e4wRhikpLmSQELMr5ynjdFdDD2vdYvMwBMb",
    "destination": "ETdQsQEH4MsJWfku4s7QjWbpQW31SzRqWVFwDwoK9X3G",
    "destination_label": "Allowed DemoUSD merchant",
    "attempt_type": "allowed_spend",
    "status": "allowed",
    "requested_amount": "5000000",
    "actual_inner_transfer_amount": "5000000",
    "vault_balance_before": "50000000",
    "vault_balance_after": "45000000",
    "vault_delta": "-5000000",
    "inner_token_transfers": 1,
    "rule_triggered": "all_clear",
    "guard_error": "",
    "logs": [
      "Program log: VAJRA_GUARD:5:per_tx_cap_check",
      "Program log: VAJRA_GUARD:6:budget_check",
      "Program log: VAJRA_GUARD:6B:period_budget_check",
      "Program log: VAJRA_GUARD:6C:velocity_check",
      "Program log: VAJRA_GUARD:7:destination_rule_check",
      "Program log: VAJRA_GUARD:8:destination_mint_check",
      "Program log: VAJRA_GUARD:9:vault_mint_check",
      "Program log: VAJRA_GUARD:10:vault_owner_check",
      "Program log: VAJRA_GUARD:11:vault_balance_check",
      "Program log: VAJRA_GUARD:12:all_clear_cpi_transfer"
    ],
    "raw_transaction_summary": { "err": null, "slot": 461078088 },
    "verifier": {
      "verified": true,
      "method": "rpc_verifier_plus_measured_vault_balance",
      "checked_at": "2026-05-09T03:17:16.787Z"
    },
    "receipt_hash": "ad7498dee090fde52fa70502f0650672844558feaa51f03de35b152f821eafc1"
  },
  {
    "receipt_version": "1.0",
    "receipt_id": "devnet:wTo4fANWAG6P3azWJ4W3MQVYn5rYpZp6s3ZijsKsN4xGP2ACCGieZgtYKXZ6wiFNW3WTek9Paeco9bozGye95p3",
    "created_at": "2026-05-09T03:17:20.800Z",
    "network": "devnet",
    "program_id": "TokenkegQfeZyiNwAJbNbGKPFXCWuBvf9Ss623VQ5DA",
    "signature": "wTo4fANWAG6P3azWJ4W3MQVYn5rYpZp6s3ZijsKsN4xGP2ACCGieZgtYKXZ6wiFNW3WTek9Paeco9bozGye95p3",
    "explorer_url": "https://explorer.solana.com/tx/wTo4fANWAG6P3azWJ4W3MQVYn5rYpZp6s3ZijsKsN4xGP2ACCGieZgtYKXZ6wiFNW3WTek9Paeco9bozGye95p3?cluster=devnet",
    "policy": "",
    "policy_id": "",
    "agent": "GDVVFih63F37uqnRFeBgWtQPAgfrGD2Hi1V6eu7MhcTi",
    "owner": "",
    "vault": "",
    "mint": "4eC4i6pmM9G6R2qSGCaNcot6KTv6xx1FcAn5GE7Px7qK",
    "source": "CgYiE1RrRKgD4JbA8yDqfygJL6XWunMkimrvKAKCwkMU",
    "destination": "BYZ9wZ7pt92bhwqfZ4umiA5TkEGy2FAcmB8QfmRXXMC9",
    "destination_label": "Red-team attacker token account",
    "attempt_type": "raw_wallet_drain",
    "status": "raw_wallet_drained",
    "requested_amount": "50000000",
    "actual_inner_transfer_amount": "0",
    "vault_balance_before": "50000000",
    "vault_balance_after": "0",
    "vault_delta": "-50000000",
    "inner_token_transfers": 0,
    "rule_triggered": "rawWalletAuthority",
    "guard_error": "",
    "logs": [
      "Program TokenkegQfeZyiNwAJbNbGKPFXCWuBvf9Ss623VQ5DA invoke [1]",
      "Program TokenkegQfeZyiNwAJbNbGKPFXCWuBvf9Ss623VQ5DA consumed 76 of 200000 compute units",
      "Program TokenkegQfeZyiNwAJbNbGKPFXCWuBvf9Ss623VQ5DA success"
    ],
    "raw_transaction_summary": {
      "err": null,
      "slot": 461078100,
      "top_level_token_transfer_amount": "50000000"
    },
    "verifier": {
      "verified": true,
      "method": "rpc_non_vajra_classification_plus_measured_token_balance",
      "checked_at": "2026-05-09T03:17:20.800Z"
    },
    "receipt_hash": "da0b2b97da21e3212b90cd1cf47e65c4875a9035447e056045e8d261fba9679b"
  },
  {
    "receipt_version": "1.0",
    "receipt_id": "devnet:5yWAEdtjihJjGWk9phXLvAG831r9yqvT7qrPgbmaFXoS5whsFSLLuuLLFGnUmKpAE22RWvFxPk3NDn1oCqfEqEf8",
    "created_at": "2026-05-09T03:17:24.878Z",
    "network": "devnet",
    "program_id": "APn6AN7FphYAjUEJWhvGZa1T5nfQDNmCcFW2244p4UoD",
    "signature": "5yWAEdtjihJjGWk9phXLvAG831r9yqvT7qrPgbmaFXoS5whsFSLLuuLLFGnUmKpAE22RWvFxPk3NDn1oCqfEqEf8",
    "explorer_url": "https://explorer.solana.com/tx/5yWAEdtjihJjGWk9phXLvAG831r9yqvT7qrPgbmaFXoS5whsFSLLuuLLFGnUmKpAE22RWvFxPk3NDn1oCqfEqEf8?cluster=devnet",
    "policy": "vCeG5UbD8BwpgDCtEetj5dp2haR1Vd6cDPFBhCvQ8yp",
    "policy_id": "1778296629815",
    "agent": "GDVVFih63F37uqnRFeBgWtQPAgfrGD2Hi1V6eu7MhcTi",
    "owner": "AePFKUi41JqyazumSmFTVxp64tev58RuQycdWfnJwMmz",
    "vault": "GY9NCwVb5e4wRhikpLmSQELMr5ynjdFdDD2vdYvMwBMb",
    "mint": "4eC4i6pmM9G6R2qSGCaNcot6KTv6xx1FcAn5GE7Px7qK",
    "source": "GY9NCwVb5e4wRhikpLmSQELMr5ynjdFdDD2vdYvMwBMb",
    "destination": "ETdQsQEH4MsJWfku4s7QjWbpQW31SzRqWVFwDwoK9X3G",
    "destination_label": "Over-cap DemoUSD merchant attempt",
    "attempt_type": "blocked_spend",
    "status": "blocked",
    "requested_amount": "50000000",
    "actual_inner_transfer_amount": "0",
    "vault_balance_before": "45000000",
    "vault_balance_after": "45000000",
    "vault_delta": "0",
    "inner_token_transfers": 0,
    "rule_triggered": "perTxCap",
    "guard_error": "Program log: AnchorError thrown in programs/vajra/src/instructions/execute_guarded_transfer.rs:80. Error Code: PerTxCapExceeded. Error Number: 6007. Error Message: Amount exceeds per-transaction cap.",
    "logs": [
      "Program log: VAJRA_GUARD:1:revoked_check",
      "Program log: VAJRA_GUARD:2:expiry_check",
      "Program log: VAJRA_GUARD:3:signer_check",
      "Program log: VAJRA_GUARD:4:amount_zero_check",
      "Program log: VAJRA_GUARD:5:per_tx_cap_check",
      "Program log: AnchorError thrown in programs/vajra/src/instructions/execute_guarded_transfer.rs:80. Error Code: PerTxCapExceeded. Error Number: 6007. Error Message: Amount exceeds per-transaction cap.",
      "Program APn6AN7FphYAjUEJWhvGZa1T5nfQDNmCcFW2244p4UoD failed: custom program error: 0x1777"
    ],
    "raw_transaction_summary": {
      "err": { "InstructionError": [0, { "Custom": 6007 }] },
      "slot": 461078111
    },
    "verifier": {
      "verified": true,
      "method": "rpc_verifier_plus_measured_vault_balance",
      "checked_at": "2026-05-09T03:17:24.878Z"
    },
    "receipt_hash": "86061c55fd156b30bb9f7dcb54f5803e4633a16ae4c025145fe03e6e80cfb8ec"
  }
]
